<?xml version="1.0" encoding="UTF-8"?>

<Clusters xmlns:xsi="http://www.w3.org/2001/XMLSchema-instance" xmlns="http://www.um.es/as"
	xsi:schemaLocation="http://www.um.es/as clusterRes.xsd">
	<place>3</place>
	<pila_gastada>10</pila_gastada>
	<pila_gastada>11</pila_gastada>
	<pila_debil>10</pila_debil>
	<cluster id="1">
		<var id="1">12.1</var>
		<var id="2">0.43</var>
	</cluster>
	<cluster id="2">
		<var id="1">12.1</var>
		<var id="2">0.43</var>
	</cluster>
	<member id="1">
		<cluster id="1">0.1</cluster>
		<cluster id="2">0.9</cluster>
	</member>
</Clusters>